{
  "schemaVersion": "1.0.0",
  "id": "subprocess-effects",
  "source_authority": "F1-architect",
  "materialization": {
    "target": ".devai/config/subprocess-effects.json",
    "allowed_verbs": ["devai init bind"],
    "authority_and_consent_required": true,
    "byte_identity_required": true,
    "adopter_binding_path_required": true,
    "direct_writes_forbidden": true
  },
  "templates": [
    {
      "template_id": "gh-dynamic-read",
      "executable": "gh",
      "argv_shape": ["<dynamic-argv>"],
      "capabilities": ["proc:gh-read"],
      "effect": "read",
      "reason": "Doctor probes a caller-selected GitHub CLI read command; runtime seam enforcement remains required for the dynamic argv.",
      "owner": "architect"
    },
    {
      "template_id": "gh-auth-status",
      "executable": "gh",
      "argv_shape": ["auth", "status"],
      "capabilities": ["proc:gh-read"],
      "effect": "read",
      "reason": "Doctor checks GitHub CLI authentication state without mutation.",
      "owner": "architect"
    },
    {
      "template_id": "gh-run-list",
      "executable": "gh",
      "argv_shape": [
        "run",
        "list",
        "--workflow",
        "<file>",
        "--event",
        "<event>",
        "--json",
        "<fields>",
        "--limit",
        "1000"
      ],
      "capabilities": ["proc:gh-read"],
      "effect": "read",
      "reason": "Harness sensors read the GitHub Actions run history of the population their declaration in .devai/config/sensor-inputs.json names (ADR-SCR-0005 IA-004, ADR-SCR-0010); the broker admits exactly this shape without a host adapter under sense run and check: <file> is one workflow file name of letters, digits, dot, underscore, or hyphen ending in .yml or .yaml, without a directory; <event> is one of push, pull_request, merge_group, workflow_dispatch, or schedule, nothing else; <fields> is one to sixteen comma-separated alphabetic names; the limit is the literal 1000, so a thirty-day window at the current volume of about 450 runs is never cut, and a list that returns 1000 runs reads unknown as truncated (#364). This shape carries no --branch option and is emitted when the declared headBranch is * (any head branch); gh-run-list-branch adds the single --branch <ref> option for a literal head branch, and the -created variants add the --created filter. Each option appears once and in this order; a second --branch, a value outside its grammar, and every other gh argv except auth, auth status, --version, and --help are refused.",
      "owner": "architect"
    },
    {
      "template_id": "gh-run-list-created",
      "executable": "gh",
      "argv_shape": [
        "run",
        "list",
        "--workflow",
        "<file>",
        "--event",
        "<event>",
        "--json",
        "<fields>",
        "--limit",
        "1000",
        "--created",
        ">=<date>"
      ],
      "capabilities": ["proc:gh-read"],
      "effect": "read",
      "reason": "The harness_green_main sensor narrows gh-run-list by creation date (ADR-SCR-0005 IA-004, ADR-SCR-0010); the broker admits exactly this shape without a host adapter under sense run and check, with the gh-run-list value grammar and <date> an ISO date or datetime after the literal >= prefix.",
      "owner": "architect"
    },
    {
      "template_id": "gh-run-list-branch",
      "executable": "gh",
      "argv_shape": [
        "run",
        "list",
        "--workflow",
        "<file>",
        "--event",
        "<event>",
        "--branch",
        "<ref>",
        "--json",
        "<fields>",
        "--limit",
        "1000"
      ],
      "capabilities": ["proc:gh-read"],
      "effect": "read",
      "reason": "Harness sensors whose declared headBranch is a literal branch reference pass it as the single --branch <ref> option (ADR-SCR-0005 IA-004, ADR-SCR-0010); the broker admits exactly this shape without a host adapter under sense run and check, with the gh-run-list value grammar and <ref> letters, digits, dot, underscore, slash, or hyphen without a leading hyphen or '..'. A second --branch is refused.",
      "owner": "architect"
    },
    {
      "template_id": "gh-run-list-branch-created",
      "executable": "gh",
      "argv_shape": [
        "run",
        "list",
        "--workflow",
        "<file>",
        "--event",
        "<event>",
        "--branch",
        "<ref>",
        "--json",
        "<fields>",
        "--limit",
        "1000",
        "--created",
        ">=<date>"
      ],
      "capabilities": ["proc:gh-read"],
      "effect": "read",
      "reason": "The harness_green_main sensor with a literal head branch narrows gh-run-list-branch by creation date (ADR-SCR-0005 IA-004, ADR-SCR-0010); the broker admits exactly this shape without a host adapter under sense run and check, with the gh-run-list-branch value grammar and <date> an ISO date or datetime after the literal >= prefix.",
      "owner": "architect"
    },
    {
      "template_id": "gh-pr-list-all",
      "executable": "gh",
      "argv_shape": [
        "pr",
        "list",
        "--state",
        "all",
        "--limit",
        "1000",
        "--json",
        "baseRefName,closedAt,createdAt,headRefName,headRefOid,mergedAt,number,state"
      ],
      "capabilities": ["proc:gh-read"],
      "effect": "read",
      "reason": "The harness_green_main sensor under outcomeUnit pull-request-final-head reads every pull request's base, state, creation and closing times and final head to admit only pull requests against the declared base and to match each with the gate runs created while it was open, by head branch and sha (ADR-SCR-0014, #365, ADR-SCR-0005 IA-004); a list that returns 1000 pull requests reads unknown as truncated; the broker admits exactly this argv without a host adapter under sense run and check, every token literal and in this order. Any other gh pr argv is refused.",
      "owner": "architect"
    },
    {
      "template_id": "gh-api-pages-deployments",
      "executable": "gh",
      "argv_shape": [
        "api",
        "/repos/<owner>/<repo>/deployments?environment=devai-pages-publication&per_page=100"
      ],
      "capabilities": ["proc:gh-read"],
      "effect": "read",
      "reason": "The site_drift sensor lists the Pages publication deployments that scripts/process/github-pages-journal.mjs records through the GitHub deployments API (ADR-AUT-0002); the broker admits exactly this shape without a host adapter: <owner>/<repo> is the journal repository the sensor declares, the endpoint and query are the fixed strings written here, the method is the implicit GET, and every option is refused, including --method, -X, -f, -F, --field, --raw-field, --input, --paginate, and --hostname. A gh api argv whose repository differs from the declared journal repository, or whose endpoint is neither this shape nor gh-api-pages-deployment-statuses, is refused although the method is GET.",
      "owner": "architect"
    },
    {
      "template_id": "gh-api-pages-deployment-statuses",
      "executable": "gh",
      "argv_shape": ["api", "/repos/<owner>/<repo>/deployments/<id>/statuses?per_page=100"],
      "capabilities": ["proc:gh-read"],
      "effect": "read",
      "reason": "The site_drift sensor lists the statuses of one Pages publication deployment, the journal's intent and verification record (ADR-AUT-0002); the broker admits exactly this shape without a host adapter: <owner>/<repo> is the journal repository the sensor declares, <id> is a decimal integer deployment id taken from gh-api-pages-deployments, the endpoint and query are the fixed strings written here, the method is the implicit GET, and every option is refused, including --method, -X, -f, -F, --field, --raw-field, --input, --paginate, and --hostname. A non-integer <id> is refused.",
      "owner": "architect"
    },
    {
      "template_id": "git-dynamic-read",
      "executable": "git",
      "argv_shape": ["<dynamic-argv>"],
      "capabilities": ["proc:git-read"],
      "effect": "read",
      "reason": "Local-evidence verification supplies a bounded read-only git argv assembled by the verifier.",
      "owner": "architect"
    },
    {
      "template_id": "git-dynamic-publish",
      "executable": "git",
      "argv_shape": ["<dynamic>"],
      "capabilities": ["proc:git-remote", "net:github-pages"],
      "effect": "remote-write",
      "reason": "Documentation publication delegates a selected git publication operation and is conservatively remote-write.",
      "owner": "architect"
    },
    {
      "template_id": "git-add",
      "executable": "git",
      "argv_shape": ["add", "--", "<dynamic>"],
      "capabilities": ["proc:git-local", "fs:workspace"],
      "effect": "local-write",
      "reason": "Round skill stages an explicit workspace path.",
      "owner": "architect"
    },
    {
      "template_id": "git-commit",
      "executable": "git",
      "argv_shape": ["commit", "-m", "<dynamic>"],
      "capabilities": ["proc:git-local", "fs:workspace"],
      "effect": "local-write",
      "reason": "Round skill creates a local commit with an explicit message.",
      "owner": "architect"
    },
    {
      "template_id": "git-diff-names",
      "executable": "git",
      "argv_shape": ["diff", "--name-only"],
      "capabilities": ["proc:git-read"],
      "effect": "read",
      "reason": "Round skill reads changed path names.",
      "owner": "architect"
    },
    {
      "template_id": "git-log-renames",
      "executable": "git",
      "argv_shape": ["log", "--all", "--diff-filter=R", "--name-status", "--pretty=format:"],
      "capabilities": ["proc:git-read"],
      "effect": "read",
      "reason": "Round skill reads rename history.",
      "owner": "architect"
    },
    {
      "template_id": "git-log-forbidden-actions",
      "executable": "git",
      "argv_shape": ["log", "<dynamic>", "--pretty=format:%H%x00%B%x1e"],
      "capabilities": ["proc:git-read"],
      "effect": "read",